{
  "schemaVersion": 1,
  "packetId": "3f1c9a52-7d1e-4a43-9b0a-6a2f1f0c8e11",
  "instanceId": "8b6f2f0e-5c3d-4f55-8d3e-1c2a7e9b4d10",
  "mode": "self-host",
  "versions": {
    "bot": "1.0.0",
    "plugins": { "1.2.0": 3, "1.1.0": 1 },
    "amongUs": { "2026.3.25": 4 }
  },
  "gauges": { "uniqueUsers": 12, "activeGames": 2, "guilds": 3, "connectedPlugins": 4 },
  "deltas": {
    "gamesMuted": 5,
    "mutes": 40,
    "unmutes": 38,
    "rateLimitHits": 0,
    "events": { "lobby": 2, "game-start": 2, "meeting-start": 6 }
  },
  "latency": { "avgMs": 142.5, "samples": 78 },
  "features": { "linkOverview": 3, "voiceRules": 1 }
}
